{
  "generated": "2026-10-13",
  "note": "Free GPU compute: a section apart from the provider ranking. Nothing here is a provider of the LLM dataset and none of it enters a provider count, a score or a collection. A value is written only when the provider's own page states it, with the sentence and the day it was read; otherwise it is not_stated.",
  "entries": [
    {
      "slug": "colab",
      "name": "Google Colab",
      "url": "https://research.google.com/colaboratory/faq.html",
      "kind": "notebook",
      "claims": {
        "gpu_access": {
          "state": "stated",
          "quotes": [
            { "text": "Colab is a hosted Jupyter Notebook service that requires no setup to use and provides free of charge access to computing resources, including GPUs and TPUs.", "source": "https://research.google.com/colaboratory/faq.html", "read": "2026-10-13" }
          ]
        },
        "quota": {
          "state": "not_stated",
          "quotes": [
            { "text": "Colab resources are not guaranteed and not unlimited, and usage limits sometimes fluctuate.", "source": "https://research.google.com/colaboratory/faq.html", "read": "2026-10-13" }
          ]
        },
        "credit_amount": { "state": "not_stated", "quotes": [] },
        "expires": { "state": "not_stated", "quotes": [] },
        "card_required": { "state": "not_stated", "quotes": [] }
      }
    },
    {
      "slug": "fal-ai",
      "name": "fal.ai",
      "url": "https://fal.ai/docs/faq",
      "kind": "serverless-api",
      "claims": {
        "gpu_access": { "state": "not_stated", "quotes": [] },
        "quota": { "state": "not_stated", "quotes": [] },
        "credit_amount": { "state": "not_stated", "quotes": [] },
        "expires": {
          "state": "not_stated",
          "quotes": [
            { "text": "If you receive free or other promotional credits, they expire in 90 days.", "source": "https://fal.ai/terms", "read": "2026-10-13" },
            { "text": "Free credits and coupons have variable expiration depending on the specific grant, ranging from 1 week to 1 year.", "source": "https://fal.ai/docs/faq", "read": "2026-10-13" }
          ]
        },
        "card_required": { "state": "not_stated", "quotes": [] }
      }
    }
  ],
  "notes": [
    {
      "subject": "Google Cloud Free Trial",
      "text": "The trial gives a $300 credit over 90 days, but while the billing account is a non-billable Free trial account you cannot add GPUs to VM instances, so it is not a free GPU offer.",
      "quotes": [
        { "text": "The Free Trial gets you a $300 Welcome credit to spend over 90 days on various Google Cloud products and you won't be billed.", "source": "https://docs.cloud.google.com/free/docs/free-cloud-features", "read": "2026-10-13" },
        { "text": "While your billing account is a non-billable Free trial account, you can't do any of the following: Add GPUs to your VM instances.", "source": "https://docs.cloud.google.com/free/docs/free-cloud-features", "read": "2026-10-13" }
      ]
    }
  ]
}
